[
 {
  "actor": "customer",
  "approval_id": null,
  "surface": "android",
  "run_id": "run-6958m5",
  "data": {},
  "kind": "tool_call",
  "claim_id": null,
  "reason": null,
  "tool": "open_claim",
  "autonomy": "automatic",
  "summary": "Llama a open_claim",
  "id": "evt_70b36f15cf6741f1a15efadea385d0af",
  "ts": "2026-10-02T07:07:34.337Z"
 },
 {
  "actor": "customer",
  "approval_id": null,
  "surface": "android",
  "run_id": "run-6958m5",
  "data": {},
  "kind": "tool_result",
  "claim_id": "CLM-50FRHQ",
  "reason": null,
  "tool": "open_claim",
  "autonomy": "automatic",
  "summary": "Reclamo CLM-50FRHQ abierto en Av. La Reforma y 12 calle, zona 10",
  "id": "evt_cab241831b0a468eb726530c139d456a",
  "ts": "2026-10-02T07:07:34.522Z"
 },
 {
  "actor": "customer",
  "approval_id": null,
  "surface": "android",
  "run_id": "run-6958m5",
  "data": {},
  "kind": "tool_call",
  "claim_id": "CLM-50FRHQ",
  "reason": null,
  "tool": "attach_claim_photos",
  "autonomy": "automatic",
  "summary": "Llama a attach_claim_photos",
  "id": "evt_2e8c632c726641dd94d20efba4ab36ca",
  "ts": "2026-10-02T07:07:37.138Z"
 },
 {
  "actor": "damage_assessor",
  "approval_id": null,
  "surface": "android",
  "run_id": "run-6958m5",
  "data": {
   "cost_range_usd": [
    350,
    650
   ],
   "severity": "moderate",
   "drivable": true,
   "assessment_seconds": 9.1,
   "photos": 3
  },
  "kind": "message",
  "claim_id": "CLM-50FRHQ",
  "reason": null,
  "tool": "attach_claim_photos",
  "autonomy": null,
  "summary": "Daño moderado en parachoques trasero y luz trasera izquierda · USD 350–USD 650",
  "id": "evt_9a5da95ccfd34baba8c010accfb723a3",
  "ts": "2026-10-02T07:07:43.138Z"
 },
 {
  "actor": "customer",
  "approval_id": null,
  "surface": "android",
  "run_id": "run-6958m5",
  "data": {},
  "kind": "tool_result",
  "claim_id": "CLM-50FRHQ",
  "reason": null,
  "tool": "attach_claim_photos",
  "autonomy": "automatic",
  "summary": "Evaluación lista: daño moderado, USD 350–USD 650",
  "id": "evt_2e564d593c794b82be9cbdb081b39e8c",
  "ts": "2026-10-02T07:07:43.214Z"
 },
 {
  "actor": "escudo_assistant",
  "approval_id": null,
  "surface": "mcp",
  "run_id": "run-6958m5",
  "data": {
   "tools": 11
  },
  "kind": "message",
  "claim_id": null,
  "reason": null,
  "tool": null,
  "autonomy": null,
  "summary": "Descubre las 11 herramientas de Escudo (MCP tools/list)",
  "id": "evt_375ea45484784e46bc036f301967bd00",
  "ts": "2026-10-02T07:07:44.760Z"
 },
 {
  "actor": "escudo_assistant",
  "approval_id": null,
  "surface": "mcp",
  "run_id": "run-6958m5",
  "data": {},
  "kind": "tool_call",
  "claim_id": "CLM-50FRHQ",
  "reason": null,
  "tool": "list_repair_options",
  "autonomy": "automatic",
  "summary": "Llama a list_repair_options",
  "id": "evt_46fd5362651b42a28e41be4b731ded30",
  "ts": "2026-10-02T07:07:49.323Z"
 },
 {
  "actor": "escudo_assistant",
  "approval_id": null,
  "surface": "mcp",
  "run_id": "run-6958m5",
  "data": {},
  "kind": "tool_call",
  "claim_id": "CLM-50FRHQ",
  "reason": null,
  "tool": "request_tow",
  "autonomy": "automatic",
  "summary": "Llama a request_tow",
  "id": "evt_60b2cffd15cd48149746841f84487e84",
  "ts": "2026-10-02T07:07:49.332Z"
 },
 {
  "actor": "escudo_assistant",
  "approval_id": null,
  "surface": "mcp",
  "run_id": "run-6958m5",
  "data": {},
  "kind": "tool_call",
  "claim_id": "CLM-50FRHQ",
  "reason": null,
  "tool": "request_rental_car",
  "autonomy": "automatic",
  "summary": "Llama a request_rental_car",
  "id": "evt_e079d4d6761c471d815a6ceb1b309ac3",
  "ts": "2026-10-02T07:07:49.357Z"
 },
 {
  "actor": "escudo_agent",
  "approval_id": null,
  "surface": "a2a",
  "run_id": "run-6958m5",
  "data": {
   "partner": "Red de Talleres",
   "skill": "repair_quotes",
   "peer": "repair_agent",
   "rpc_url": "https://escudo-api-611681112050.us-central1.run.app/a2a/repair"
  },
  "kind": "message",
  "claim_id": "CLM-50FRHQ",
  "reason": null,
  "tool": "list_repair_options",
  "autonomy": null,
  "summary": "Descubre a Red de Talleres por su Agent Card: ofrece «Cotización de reparación»",
  "id": "evt_c852835afbc94ec0aef214a05e9452ad",
  "ts": "2026-10-02T07:07:49.518Z"
 },
 {
  "actor": "escudo_agent",
  "approval_id": null,
  "surface": "a2a",
  "run_id": "run-6958m5",
  "data": {
   "partner": "Grúas Aliadas",
   "skill": "tow_dispatch",
   "peer": "tow_agent",
   "rpc_url": "https://escudo-api-611681112050.us-central1.run.app/a2a/tow"
  },
  "kind": "message",
  "claim_id": "CLM-50FRHQ",
  "reason": null,
  "tool": "request_tow",
  "autonomy": null,
  "summary": "Descubre a Grúas Aliadas por su Agent Card: ofrece «Despacho de grúa»",
  "id": "evt_87959dca37274b0bacded6c706145654",
  "ts": "2026-10-02T07:07:49.564Z"
 },
 {
  "actor": "escudo_agent",
  "approval_id": null,
  "surface": "a2a",
  "run_id": "run-6958m5",
  "data": {
   "partner": "Red de Talleres",
   "skill": "repair_quotes",
   "peer": "repair_agent",
   "rpc_url": "https://escudo-api-611681112050.us-central1.run.app/a2a/repair",
   "discovered_via": "agent_card"
  },
  "kind": "a2a_request",
  "claim_id": "CLM-50FRHQ",
  "reason": null,
  "tool": "list_repair_options",
  "autonomy": null,
  "summary": "Pide cotizaciones a Red de Talleres por A2A",
  "id": "evt_451944387b29481c9100728021c335c0",
  "ts": "2026-10-02T07:07:49.587Z"
 },
 {
  "actor": "escudo_agent",
  "approval_id": null,
  "surface": "a2a",
  "run_id": "run-6958m5",
  "data": {
   "partner": "Grúas Aliadas",
   "skill": "tow_dispatch",
   "peer": "tow_agent",
   "rpc_url": "https://escudo-api-611681112050.us-central1.run.app/a2a/tow",
   "discovered_via": "agent_card"
  },
  "kind": "a2a_request",
  "claim_id": "CLM-50FRHQ",
  "reason": null,
  "tool": "request_tow",
  "autonomy": null,
  "summary": "Pide una grúa a Grúas Aliadas por A2A",
  "id": "evt_3c94ef89ac7248b099b625884df224db",
  "ts": "2026-10-02T07:07:49.633Z"
 },
 {
  "actor": "repair_agent",
  "approval_id": null,
  "surface": "a2a",
  "run_id": "run-6958m5",
  "data": {
   "shops": [
    "AutoPintura Mixco",
    "Servicio Integral CAES",
    "Taller Carrocería Diez"
   ]
  },
  "kind": "a2a_response",
  "claim_id": "CLM-50FRHQ",
  "reason": null,
  "tool": "list_repair_options",
  "autonomy": null,
  "summary": "3 talleres cotizados, desde USD 520",
  "id": "evt_65c284632d014f4a9ea7b7a996d338c9",
  "ts": "2026-10-02T07:07:49.808Z"
 },
 {
  "actor": "tow_agent",
  "approval_id": null,
  "surface": "a2a",
  "run_id": "run-6958m5",
  "data": {
   "provider": "Grúas Express Guate",
   "eta_minutes": 14
  },
  "kind": "a2a_response",
  "claim_id": "CLM-50FRHQ",
  "reason": null,
  "tool": "request_tow",
  "autonomy": null,
  "summary": "Grúas Express Guate: llega en 14 min",
  "id": "evt_2caf0192ed564bb482c65262ee776048",
  "ts": "2026-10-02T07:07:49.826Z"
 },
 {
  "actor": "escudo_assistant",
  "approval_id": null,
  "surface": "mcp",
  "run_id": "run-6958m5",
  "data": {},
  "kind": "tool_result",
  "claim_id": "CLM-50FRHQ",
  "reason": null,
  "tool": "request_rental_car",
  "autonomy": "automatic",
  "summary": "Auto de reemplazo reservado: 7 días, sin costo",
  "id": "evt_1d6062abb24a499f9066beb56bb797e7",
  "ts": "2026-10-02T07:07:49.833Z"
 },
 {
  "actor": "escudo_assistant",
  "approval_id": null,
  "surface": "mcp",
  "run_id": "run-6958m5",
  "data": {},
  "kind": "tool_result",
  "claim_id": "CLM-50FRHQ",
  "reason": null,
  "tool": "list_repair_options",
  "autonomy": "automatic",
  "summary": "3 talleres disponibles; desde USD 520 (AutoPintura Mixco)",
  "id": "evt_690482125d9842c28284f5dc10dc6225",
  "ts": "2026-10-02T07:07:49.954Z"
 },
 {
  "actor": "escudo_assistant",
  "approval_id": null,
  "surface": "mcp",
  "run_id": "run-6958m5",
  "data": {},
  "kind": "tool_result",
  "claim_id": "CLM-50FRHQ",
  "reason": null,
  "tool": "request_tow",
  "autonomy": "automatic",
  "summary": "Grúa en camino: Grúas Express Guate, llega en 14 min",
  "id": "evt_a9bf247594f44bebade06e3d863329c1",
  "ts": "2026-10-02T07:07:50.026Z"
 },
 {
  "actor": "escudo_assistant",
  "approval_id": null,
  "surface": "mcp",
  "run_id": "run-6958m5",
  "data": {},
  "kind": "tool_call",
  "claim_id": "CLM-50FRHQ",
  "reason": null,
  "tool": "select_repair_shop",
  "autonomy": "needs_approval",
  "summary": "Llama a select_repair_shop",
  "id": "evt_623d7bd4d6dc450782e480bef57e2e16",
  "ts": "2026-10-02T07:07:56.026Z"
 },
 {
  "actor": "backend",
  "approval_id": "apr_7n0M9Rn2pA9ZeRbb",
  "surface": "mcp",
  "run_id": "run-6958m5",
  "data": {},
  "kind": "approval_requested",
  "claim_id": "CLM-50FRHQ",
  "reason": "Reserva un taller y un horario a tu nombre.",
  "tool": "select_repair_shop",
  "autonomy": "needs_approval",
  "summary": "Esperando aprobación de la clienta: Reservar Taller Carrocería Diez el viernes 2 de octubre, 8:00. Cotización USD 630; tú solo pagas el deducible.",
  "id": "evt_ba5ecfa19c214fe58e6d9573fc8ba2ad",
  "ts": "2026-10-02T07:07:56.228Z"
 },
 {
  "actor": "customer",
  "approval_id": "apr_7n0M9Rn2pA9ZeRbb",
  "surface": "android",
  "run_id": "run-6958m5",
  "data": {
   "device_id": "chat-run-6958m5"
  },
  "kind": "approval_granted",
  "claim_id": "CLM-50FRHQ",
  "reason": null,
  "tool": "select_repair_shop",
  "autonomy": "needs_approval",
  "summary": "Aprobado por la clienta: Reservar Taller Carrocería Diez el viernes 2 de octubre, 8:00. Cotización USD 630; tú solo pagas el deducible.",
  "id": "evt_afc26b6199a844bcbc85a49348d5523a",
  "ts": "2026-10-02T07:08:02.088Z"
 },
 {
  "actor": "escudo_assistant",
  "approval_id": null,
  "surface": "mcp",
  "run_id": "run-6958m5",
  "data": {},
  "kind": "tool_call",
  "claim_id": "CLM-50FRHQ",
  "reason": null,
  "tool": "list_repair_options",
  "autonomy": "automatic",
  "summary": "Llama a list_repair_options",
  "id": "evt_6d3070960a6140d291b4017f8f61beba",
  "ts": "2026-10-02T07:08:08.088Z"
 },
 {
  "actor": "escudo_agent",
  "approval_id": null,
  "surface": "a2a",
  "run_id": "run-6958m5",
  "data": {